Casa en calle de Humanes,MADRID SUR GESTIÓN INMOBILIARIA,1.275 €/m²,267.900 €,210 m²,https://www.pisos.com/comprar/casa-parla_centro-25839596924_513812/,Anuncio actualizado el 04/02/2025,Error al procesar consumo,Error al procesar emisiones,madrid_sur,210 m²,200 m²,90 m²,4,3,Entre 30 y 50 años,En buen estado,4513812-000029,,N/A,Gres,,Aluminio,Frío y calor,Eléctrica,N/A,N/A,1,N/A,N/A,,,Noreste,N/A,N/A,,,,,,N/A,,,,N/A,N/A,N/A,N/A,,,,N/A,,,,,
Casa adosada en calle de los Alces,HOGARES GRIÑON,1.839 €/m²,264.900 €,144 m²,https://www.pisos.com/comprar/casa_adosada-cubas_de_la_sagra_centro_urbano-50046560624_101800/,Anuncio actualizado el 19/02/2025,"E, E","E, E",madrid_sur,144 m²,,254 m²,3,2,Entre 30 y 50 años,,IF76953-Alces,1,,,,,,Central,N/A,,1,N/A,,Privado,Comunitaria,,,,Adosada,,,,,N/A,,,,N/A,,,,,,,,,,,,
Chalet unifamiliar en Griñón,INMOAMP,1.324 €/m²,567.000 €,428 m²,https://www.pisos.com/comprar/chalet_unifamiliar-grinon_centro_urbano-47524593379_523885/,Anuncio actualizado el 20/01/2025,"B, C","B, C",madrid_sur,428 m²,405 m²,569 m²,6,4,Entre 20 y 30 años,Reformado,4523885-000053,Más de 2,Madera de roble,Parquet,,PVC,Preinstalación en toda la vivienda,Gas natural,Las 2 amuebladas con algunos electrodomésticos,"En cocina, salón y sótano",2,N/A,N/A,Privado,Propia,Suroeste,N/A,N/A,,,,,,,,Natural canalizado,,N/A,,N/A,Fibra,2 de leña,,N/A,N/A,,,,,
Casa pareada en calle Huerta del Cura,HOGARES GRIÑON,1.186 €/m²,356.000 €,300 m²,https://www.pisos.com/comprar/casa_pareada-moraleja_de_enmedio_centro_urbano-37555315066_101800/,Anuncio actualizado el 19/02/2025,"D, D","D, D",madrid_sur,300 m²,,160 m²,4,3,Entre 10 y 20 años,,IF76953-huerta cura,1,,,,,,Central,N/A,,1,N/A,N/A,Privado,,,,,Pareada,N/A,,,,,,,,,,,,,,,,,,,,
Casa pareada en Torrejón de la Calzada,Tecnocasa Torrejón de la calzada,1.555 €/m²,419.900 €,270 m²,https://www.pisos.com/comprar/casa_pareada-torrejon_de_la_calzada_centro_urbano-49203669180_100200/,Anuncio actualizado el 06/12/2024,Error al procesar consumo,Error al procesar emisiones,madrid_sur,270 m²,,,4,3,Entre 20 y 30 años,En buen estado,TC1086-601380,1,,,,,N/A,N/A,,,,,N/A,Privado,,,,,Pareada,,,,,,,,,,,,,,,,,,,,,
Piso en Getafe,Yourhabitat,4.466 €/m²,536.000 €,120 m²,https://www.pisos.com/comprar/piso-getafe_el_bercial28907-51704509238_100500/,Anuncio actualizado el 03/02/2025,Error al procesar consumo,Error al procesar emisiones,madrid_sur,120 m²,92 m²,,3,2,Menos de 5 años,En buen estado,SA292-318,1,,Gres,N/A,,Frío,Gas natural,Cocina amueblada,,1,N/A,N/A,Comunitario,Comunitaria,Norte,,,,N/A,1ª,N/A,Más de 100 €,,N/A,,,N/A,,,,,N/A,,,,,,,
Chalet en calle Bellatrix,HOGARES GRIÑON,1.328 €/m²,489.000 €,368 m²,https://www.pisos.com/comprar/chalet-grinon_centro_urbano-37522453986_101800/,Anuncio actualizado el 19/02/2025,"D, D","D, D",madrid_sur,368 m²,,500 m²,6,4,Entre 20 y 30 años,,IF76953-BELLATRIX,1,,,,,,Central,,,1,,,Privado,Propia,,,,,N/A,,,,,,,,,N/A,,,,,,,,,,,
Dúplex en calle de Fuente de la Salud,HOGARES GRIÑON,1.845 €/m²,167.900 €,91 m²,https://www.pisos.com/comprar/duplex-grinon_centro_urbano-34205520380_101800/,Anuncio actualizado el 19/02/2025,"D, D","D, D",madrid_sur,91 m²,,,2,2,Entre 10 y 20 años,,IF76953-Griñon 2,1,,,,,,Central,N/A,,1,,,,,,,,,,,,,,,,,,,,,,,,,,,,,
Casa pareada en calle de los Robles,HOGARES GRIÑON,1.874 €/m²,329.900 €,176 m²,https://www.pisos.com/comprar/casa_pareada-cubas_de_la_sagra_centro_urbano-45902872814_101800/,Anuncio actualizado el 19/02/2025,"C, C","C, C",madrid_sur,176 m²,,215 m²,3,3,Entre 10 y 20 años,,IF76953-ROBLES,1,,,,,,Central,N/A,,,N/A,,Privado,Propia,,,,Pareada,,,,,,,,,,,,,,,,,,,,,
Casa pareada en calle Corrobla,HOGARES GRIÑON,1.377 €/m²,310.000 €,225 m²,https://www.pisos.com/comprar/casa_pareada-cubas_de_la_sagra_centro_urbano-35849798106_101800/,Anuncio actualizado el 19/02/2025,"D, D","D, D",madrid_sur,225 m²,,175 m²,4,2,Entre 10 y 20 años,,IF76953-53,1,,,,,,Central,N/A,,1,N/A,N/A,Privado,Comunitaria,A la montaña,,,Pareada,N/A,,,,,,,,,N/A,,,,,,,,,,,
"Piso en calle de Móstoles, 72",Centro Comercial Inmobiliario10,2.846 €/m²,316.000 €,111 m²,https://www.pisos.com/comprar/piso-naranjo_la_serna28942-5185658418_109700/,Anuncio actualizado el 14/02/2025,Error al procesar consumo,Error al procesar emisiones,madrid_sur,111 m²,,,3,2,,A estrenar,IF4098-CCI-022-000049227,,,,,,,,N/A,,N/A,,N/A,,,,,,,N/A,5ª,,,,,,,,,,,,,,,,,,,
Piso en calle Isla Conejera,INMOCASTILLO,1.860 €/m²,400.000 €,215 m²,https://www.pisos.com/comprar/piso-humanes_de_madrid_centro_urbano-51671772016_529204/,Anuncio actualizado el 19/02/2025,Error al procesar consumo,Error al procesar emisiones,madrid_sur,215 m²,120 m²,,3,2,Entre 20 y 30 años,En buen estado,4529204-000014,Más de 2,,,,,Frío y calor,Gas natural,Muy luminosa,N/A,2,,N/A,,,,,,,,3ª,N/A,Entre 60 y 80 €,,N/A,,,,,,,,N/A,N/A,,,,,,
Piso en calle de Valeras,INMOBILIARIA MAXIMO C&O,1.551 €/m²,225.000 €,145 m²,https://www.pisos.com/comprar/piso-aranjuez_centro-48407779493_994226/,Anuncio actualizado el 31/01/2025,Error al procesar consumo,Error al procesar emisiones,madrid_sur,145 m²,130 m²,,4,2,Entre 30 y 50 años,A reformar,4994226-9269178,1,,Parquet,,Aluminio,,Gas natural,,,,,Tiene dos terrazas,,,Sur,,,,Tiene trastero,3ª,N/A,Entre 60 y 80 €,,N/A,,N/A,,Situado en terraza que dispone de tendedero,,,,,N/A,N/A,,,,,
Piso en calle Ruta del Incienso,FYSOL INMOBILIARIAS,1.778 €/m²,185.000 €,104 m²,https://www.pisos.com/comprar/piso-la_montana_cortijo_de_san_isidro28300-50835956491_100500/,Anuncio actualizado el 22/01/2025,Error al procesar consumo,Error al procesar emisiones,madrid_sur,104 m²,88 m²,,3,2,Entre 20 y 30 años,En buen estado,SA5403-02460,1,,,,,N/A,,,,1,,,,,,,,,N/A,3ª,N/A,,,N/A,,,,,,,,,N/A,,,,N/A,,
Piso en Plaza de Parejas,FYSOL INMOBILIARIAS,3.611 €/m²,390.000 €,108 m²,https://www.pisos.com/comprar/piso-aranjuez_centro-50844553751_100500/,Anuncio actualizado el 13/02/2025,Error al procesar consumo,Error al procesar emisiones,madrid_sur,108 m²,,,3,2,,En buen estado,SA5403-02470,1,,,,,N/A,,,,,,,,,Norte,,,,,,N/A,,,,,,,,,,,,,,,,,,
Piso en Area Metropolitana,Concepción HERNANDEZ TENDERO,3.158 €/m²,319.000 €,101 m²,https://www.pisos.com/comprar/piso-getafe_juan_de_la_cierva28903-50064470103_108700/,Anuncio actualizado el 14/02/2025,Error al procesar consumo,Error al procesar emisiones,madrid_sur,101 m²,101 m²,,3,1,Más de 50 años,,UVC841-30520,,,,,,,,,,,,,,,,,,,,,,,,N/A,,,,,,,,,,,,,,,
Estudio en Centro,TIZONA MÓSTOLES BARCELONA,3.886 €/m²,139.900 €,36 m²,https://www.pisos.com/comprar/estudio-leganes_centro28912-51674131257_100500/,Anuncio actualizado el 07/02/2025,"G, G","G, G",madrid_sur,36 m²,35 m²,,,1,,En buen estado,SA4146-107259500,,,,,,N/A,,,,1,,,,,Este,,,,,,N/A,Entre 40 y 60 €,,,,,,,,,,,N/A,,,,,,
Casa en calle Escribano,PROLUCISA S.L,1.535 €/m²,350.000 €,228 m²,https://www.pisos.com/comprar/casa-moraleja_de_enmedio_centro_urbano-49262242408_305300/,Anuncio actualizado el 20/02/2025,Error al procesar consumo,Error al procesar emisiones,madrid_sur,228 m²,228 m²,310 m²,5,2,,Reformado,3053-010065,Armarios empotrados y forrados,Puertas y armarios empotrados de roble,Gres,Climalit,Ventanas y persianas de aluminio,,Gasoil,Dos cocinas,Dos comedores independientes,1,N/A,N/A,N/A,,Doble orientacion norte - sur,N/A,,,,,,Sin gastos de comunidad,,,,,,,,,,,,N/A,,,,,
Casa pareada en Serranillos del Valle,Tecnocasa Torrejón de la calzada,1.890 €/m²,379.900 €,201 m²,https://www.pisos.com/comprar/casa_pareada-serranillos_del_valle_centro_urbano-50854590505_100200/,Anuncio actualizado el 28/01/2025,Error al procesar consumo,Error al procesar emisiones,madrid_sur,201 m²,,,4,3,Entre 20 y 30 años,En buen estado,TC1086-605782,,,,,,,N/A,,,1,,,,,,,,Pareada,,,,,,,,,,,,,,,,,,,,,
Chalet unifamiliar en Urbanización de las Colinas,PROLUCISA S.L,1.613 €/m²,355.000 €,220 m²,https://www.pisos.com/comprar/chalet_unifamiliar-moraleja_de_enmedio_centro_urbano-47576224048_305300/,Anuncio actualizado el 18/02/2025,Error al procesar consumo,Error al procesar emisiones,madrid_sur,220 m²,200 m²,500 m²,4,3,,En buen estado,3053-010156,Más de 2,,Gres,N/A,Aluminio,Frío y calor,Gasoil,N/A,N/A,2,N/A,N/A,Privado,Propia,Sur,N/A,N/A,,,,,,,,,,,,N/A,N/A,N/A,,,,,,,,
Piso en Hispanoamérica-Las Comunidades,"ESTUDIO NUEVO RESTON, S.L.",2.755 €/m²,259.000 €,94 m²,https://www.pisos.com/comprar/piso-hispanoamerica_las_comunidades-49221646432_100200/,Anuncio actualizado el 20/02/2025,"E, E","E, E",madrid_sur,94 m²,,,3,2,Entre 20 y 30 años,En buen estado,TC176-602267,,,Gres,,,N/A,N/A,N/A,,,,N/A,Comunitario,,,,,,N/A,,,,,N/A,,N/A,,,,,,,,,,,,,
Chalet en calle de los Ruiseñores,HOGARES GRIÑON,1.152 €/m²,484.000 €,420 m²,https://www.pisos.com/comprar/chalet-grinon_centro_urbano-34227919197_101800/,Anuncio actualizado el 19/02/2025,"E, E","E, E",madrid_sur,420 m²,,995 m²,6,5,Entre 20 y 30 años,,IF76953-ruiseñores,1,,,,,,Central,N/A,,1,N/A,,Privado,Propia,Suroeste,,,,N/A,,,,,,,,,,,,,,,,,,,,
Piso en Centro,ARQUIPISOS GESTION,2.760 €/m²,207.000 €,75 m²,https://www.pisos.com/comprar/piso-leganes_centro28911-50099108025_101800/,Anuncio actualizado el 13/02/2025,Error al procesar consumo,Error al procesar emisiones,madrid_sur,75 m²,,,3,1,,,IF6924-VCN153,1,,,,,,Central,N/A,,,N/A,,,,,,,,,,,,,N/A,,,,,,,,,,,,,,,
Chalet en calle Encinas,HOGARES GRIÑON,1.439 €/m²,264.900 €,184 m²,https://www.pisos.com/comprar/chalet-cubas_de_la_sagra_centro_urbano-34222217234_101800/,Anuncio actualizado el 19/02/2025,"D, D","D, D",madrid_sur,184 m²,,541 m²,3,2,Entre 10 y 20 años,,IF76953-encinas,1,,,,,,Central,N/A,,1,N/A,N/A,Privado,Propia,Sureste,,,,,,,,,,,,,N/A,,,,,,,,,,,
Casa pareada en calle Mester de Juglaria,HOGARES GRIÑON,1.666 €/m²,389.900 €,234 m²,https://www.pisos.com/comprar/casa_pareada-cubas_de_la_sagra_centro_urbano-45039366657_101800/,Anuncio actualizado el 19/02/2025,"D, D","D, D",madrid_sur,234 m²,,240 m²,5,3,Entre 10 y 20 años,,IF76953-Mester de Juglaria,1,,,,,,Central,N/A,,1,N/A,N/A,Privado,Propia,,,,Pareada,,,,,,,,,,N/A,,,,,,,,,,,
Piso en Buenos Aires-Cañada Real de Toledo-Puerta de Pinto,Stanton Carsons,2.289 €/m²,190.000 €,83 m²,https://www.pisos.com/comprar/piso-buenos_aires_canada_real_de_toledo_puerta_de_pinto-50910526307_108500/,Anuncio actualizado el 30/01/2025,Error al procesar consumo,Error al procesar emisiones,madrid_sur,83 m²,,,3,1,,,AG542-PIS1379,,,Gres,N/A,,N/A,,Individual,,,N/A,No acristalada,,,Suroeste,,,,,,N/A,,,N/A,,,,,,,,,N/A,,,,,,
Casa adosada en Hispanoamérica-Las Comunidades,"ESTUDIO NUEVO RESTON, S.L.",1.945 €/m²,465.000 €,239 m²,https://www.pisos.com/comprar/casa_adosada-hispanoamerica_las_comunidades-50849309715_100200/,Anuncio actualizado el 20/02/2025,"E, E","E, E",madrid_sur,239 m²,,,5,3,Entre 30 y 50 años,En buen estado,TC176-502618,,,,,,,N/A,,,1,,,,,,,,Adosada,,,,,,,,,,,,,,,,,,,,,
Piso en Humanes de Madrid,PROLUCISA S.L,2.038 €/m²,265.000 €,130 m²,https://www.pisos.com/comprar/piso-humanes_de_madrid_centro_urbano-49187581405_305300/,Anuncio actualizado el 18/02/2025,Error al procesar consumo,Error al procesar emisiones,madrid_sur,130 m²,116 m²,,3,2,Entre 20 y 30 años,Reformado,3053-020039,En todos los dormitorios y en el pasillo,Puertas lacadas en blanco,"Plaqueta de gres ceramico en cocina y baños, parqu",De climalit,Pvc lacado,En comedor y dormitorio,Gas natural,"Muy amplia, mesa, dos encimeras y salida al patio",Independiente muy amplio terraza aire acondicionad,1,N/A,,,,Suroeste,,,,,1ª,N/A,78€ y 60€ derrama,,N/A,,N/A,,,,,,N/A,,N/A,,,N/A,,
Piso en calle del Planeta Tierra,ELEPHANT ROOM MADRID,2.912 €/m²,265.000 €,91 m²,https://www.pisos.com/comprar/piso-parla_este28983-51751026956_100500/,Anuncio actualizado el 18/02/2025,"E, E","E, E",madrid_sur,91 m²,70 m²,,3,2,Entre 10 y 20 años,,SA3035-06953/7621,1,,Gres,,,N/A,Gas natural,,,1,,,N/A,Comunitaria,Noreste,,,,N/A,6ª,,,,N/A,,,,,,,,,,,,,,,
Chalet adosado en Moraleja de Enmedio,PROLUCISA S.L,2.585 €/m²,349.000 €,135 m²,https://www.pisos.com/comprar/chalet_adosado-moraleja_de_enmedio_centro_urbano-50910782897_305300/,Anuncio actualizado el 18/02/2025,Error al procesar consumo,Error al procesar emisiones,madrid_sur,135 m²,135 m²,95 m²,4,3,Entre 20 y 30 años,En buen estado,3053-010039,N/A,Oscilobatiente,Tarima maciza,Climalit cristal termico,,Frío y calor,Gas natural,,,1,N/A,,Comunitario,Comunitaria,Suroeste,N/A,N/A,,,,,Entre 40 y 60 €,,,N/A,,,,N/A,N/A,,,,,,,,,
Chalet en Plaza de Navarrete,FYSOL INMOBILIARIAS,1.802 €/m²,575.000 €,319 m²,https://www.pisos.com/comprar/chalet-nuevo_aranjuez_ciudad_de_las_artes_el_mirador-45037475302_100500/,Anuncio actualizado el 22/10/2024,Error al procesar consumo,Error al procesar emisiones,madrid_sur,319 m²,,918 m²,4,3,Entre 30 y 50 años,En buen estado,SA5403-01693,1,,,,,N/A,,,,,,N/A,N/A,N/A,,,,,N/A,,,,,,,,,,,,,,,,,,,,
Piso en Centro,TECNOCASA - VALDEMORO,2.063 €/m²,227.000 €,110 m²,https://www.pisos.com/comprar/piso-valdemoro_centro28341-51668549806_100200/,Anuncio actualizado el 14/02/2025,"E, E","E, E",madrid_sur,110 m²,,,3,1,Entre 30 y 50 años,En buen estado,TC4-608103,,,,,,N/A,N/A,,,,,,,,,,,,,,,,,N/A,,,,,,,,,,,,,,,
Chalet unifamiliar en calle de Cáceres,INMOBILIARIA MAXIMO C&O,1.286 €/m²,490.000 €,381 m²,https://www.pisos.com/comprar/chalet_unifamiliar-la_montana_cortijo_de_san_isidro28300-48338220282_994226/,Anuncio actualizado el 19/11/2024,Error al procesar consumo,Error al procesar emisiones,madrid_sur,381 m²,340 m²,697 m²,5,3,Entre 10 y 20 años,En buen estado,4994226-9269181,Más de 2,Puertas lacadas en blanco,Tarima flotante,Toipo climalit,Aluminio,Frío y calor,Gas natural,Preciosa cocina con isla que integra al comedor,N/A,Más de 2,N/A,N/A,Privado,Propia,Todos las,N/A,N/A,,,,,,,,N/A,,,Independiente en plata sótano,N/A,N/A,N/A,,,,,,,,
Piso en calle de los Siete Picos,PROLUCISA S.L,2.291 €/m²,165.000 €,72 m²,https://www.pisos.com/comprar/piso-moraleja_de_enmedio_centro_urbano-49201943433_305300/,Anuncio actualizado el 18/02/2025,Error al procesar consumo,Error al procesar emisiones,madrid_sur,72 m²,72 m²,,2,1,Entre 20 y 30 años,Reformado,3053-020024,En todos los dormitorios,Puertas lacadas en blanco,De gres cerámico,De climalit,PVC,Dos aparatos de aire acondicionado de bajo consumo,Eléctrica,Americana,ámplio y muy luminoso,,N/A,Con vistas despejadas,,,Sureste,,,,,3ª,N/A,,,,,,,,,,,N/A,,,,,,,
Casa adosada en Hispanoamérica - Comunidades,MASMETROS GESTION INMOBILIARIA,1.529 €/m²,390.000 €,255 m²,https://www.pisos.com/comprar/casa_adosada-hispanoamerica_las_comunidades-51725031734_100500/,Anuncio actualizado el 18/02/2025,"D, D","D, D",madrid_sur,255 m²,174 m²,184 m²,3,3,Entre 10 y 20 años,,SA820-4236/2372,1,,,,,,Gas natural,,,1,N/A,N/A,N/A,Comunitaria,Sureste,,,Adosada,N/A,,,Entre 40 y 60 €,,,,,,,,,,,,,,,,,
Chalet en Cubas de La Sagra,TodoMadridFm,2.035 €/m²,340.000 €,167 m²,https://www.pisos.com/comprar/chalet-cubas_de_la_sagra_centro_urbano-50855874845_106700/,Anuncio actualizado el 23/01/2025,Error al procesar consumo,Error al procesar emisiones,madrid_sur,167 m²,,190 m²,3,3,,,IFC76269-TM824,,,,,,,,,,,,,,,,,,,,,,,,,,,,,,,,,,,,,,,
Piso en Estación,TECNOCASA - VALDEMORO,2.645 €/m²,177.260 €,67 m²,https://www.pisos.com/comprar/piso-valdemoro_estacion-51718658844_100200/,Anuncio actualizado el 19/02/2025,"E, E","E, E",madrid_sur,67 m²,,,2,1,Entre 20 y 30 años,En buen estado,TC4-609876,,,,,,,N/A,,,,,,,,,,,,,,,,,N/A,,,,,,,,,,,,,,,
Dúplex en calle calle del Torreón,HOGARES GRIÑON,2.141 €/m²,179.900 €,84 m²,https://www.pisos.com/comprar/duplex-grinon_centro_urbano-37556967136_101800/,Anuncio actualizado el 19/02/2025,"D, D","D, D",madrid_sur,84 m²,,,3,1,Entre 20 y 30 años,,IF76953-Torreón,1,,,,,,Central,N/A,,1,,,,Comunitaria,,,,,,,,,,N/A,,,,N/A,,,,,,,,,,,
Piso en Juan de la Cierva,ALFA URBIZA,2.933 €/m²,199.500 €,68 m²,https://www.pisos.com/comprar/piso-getafe_juan_de_la_cierva28903-51688983208_101000/,Anuncio actualizado el 13/02/2025,Error al procesar consumo,Error al procesar emisiones,madrid_sur,68 m²,,,3,1,,,AF210-2304/441,,,,,,Frío,,,,,,,,,Norte,,,,,,N/A,,,,,,,,,,,,,,,,,,
Piso en Plaza de Emilio Simón,inmoversion,2.500 €/m²,220.000 €,88 m²,https://www.pisos.com/comprar/piso-leganes_centro28911-49219920492_100500/,Anuncio actualizado el 17/01/2025,Error al procesar consumo,Error al procesar emisiones,madrid_sur,88 m²,71 m²,,3,1,Más de 50 años,,SA5031-NM00949/11056,,,,,,,,,,,,N/A,N/A,,,,,,N/A,Bajo,,,,N/A,,,,,,,,,,,,,,,
Chalet adosado en calle de Granja,PROLUCISA S.L,1.500 €/m²,360.000 €,240 m²,https://www.pisos.com/comprar/chalet_adosado-moraleja_de_enmedio_centro_urbano-34176544698_305300/,Anuncio actualizado el 18/02/2025,Error al procesar consumo,Error al procesar emisiones,madrid_sur,240 m²,240 m²,250 m²,5,3,,En buen estado,3053-010008,En todos los dormitorios y en el pasillo,"Armarios empotrados de roble, puertas de pino","Parquet de espiga, plaqueta de gres y escalera de",De climalit,Pvc lacado blanco,En todos los dormitorios y en el comedor,De gasoil con deposito de 750 litros,Office amplia completamente equipada mesa y banco,26 metros salida directa al jardin aire acondicion,Más de 2,N/A,,N/A,Propia,Doble orientacion sur y norte,N/A,N/A,,,,,Sin gastos de comunidad,,,,,,,,,,,,N/A,,,,,
"Piso en calle del Postiguillo, 7",REALIA BUSINESS S.A.,2.653 €/m²,390.000 €,147 m²,https://www.pisos.com/comprar/piso-valdemoro_hospital28342-5160810287_109700/,Anuncio actualizado el 07/01/2025,"A, A","A, A",madrid_sur,147 m²,,,4,,,A estrenar,-99970,,,,,,,,,,N/A,,,,,,,,,N/A,1ª,,,,N/A,,,,,,,,,,,,,,,
Chalet adosado en Cubas de La Sagra,INMOBILIARIA ERIA HOUSE,1.359 €/m²,339.900 €,250 m²,https://www.pisos.com/comprar/chalet_adosado-cubas_de_la_sagra_centro_urbano-50907033957_529135/,Anuncio actualizado el 10/01/2025,Error al procesar consumo,Error al procesar emisiones,madrid_sur,250 m²,200 m²,250 m²,3,3,Entre 30 y 50 años,En buen estado,4529135-000002,Más de 2,,Tarima flotante,Contraventana y mosquiteras,,Frío y calor,Gas natural,N/A,N/A,,,,Privado,Comunitaria,Noroeste,,,,,,,Entre 60 y 80 €,,,,,,,,,,,,,,,,,
Dúplex en calle del Rey,FYSOL INMOBILIARIAS,1.531 €/m²,395.000 €,258 m²,https://www.pisos.com/comprar/duplex-aranjuez_centro-45043486354_100500/,Anuncio actualizado el 17/01/2025,Error al procesar consumo,Error al procesar emisiones,madrid_sur,258 m²,,,6,3,Entre 30 y 50 años,En buen estado,SA5403-02180,1,,,,,N/A,,,,,,,,,Sur,,,,N/A,2ª,N/A,Más de 100 €,,N/A,,,,,,,,,,,,,N/A,,
Casa adosada en Hispanoamérica-Las Comunidades,Stanton Carsons,1.555 €/m²,420.000 €,270 m²,https://www.pisos.com/comprar/casa_adosada-hispanoamerica_las_comunidades-49253839736_108500/,Anuncio actualizado el 21/01/2025,Error al procesar consumo,Error al procesar emisiones,madrid_sur,270 m²,260 m²,,4,3,,,AG542-106664225,N/A,,,,,N/A,Gas natural,,,,,,,,Suroeste,,,Adosada,N/A,,,,,,,,,,,,,,,,,,,,
Apartamento en calle de Óscar Domínguez,TU CASA ALCORCON INMOBILIARIA,2.958 €/m²,177.500 €,60 m²,https://www.pisos.com/comprar/apartamento-la_teneria_i_la_teneria_ii-38427280241_524927/,Anuncio actualizado el 22/11/2024,Error al procesar consumo,Error al procesar emisiones,madrid_sur,60 m²,45 m²,,1,1,,En buen estado,4524927-000042,1,,Tarima maciza,,PVC,Frío y calor,Gas natural,N/A,,1,N/A,N/A,,,Suroeste,,,,N/A,3ª,N/A,,,N/A,,N/A,,,,,,N/A,,,,,,,
Ático en El Restón,"ESTUDIO NUEVO RESTON, S.L.",2.564 €/m²,359.000 €,140 m²,https://www.pisos.com/comprar/atico-el_reston-51669417927_100200/,Anuncio actualizado el 20/02/2025,"E, E","E, E",madrid_sur,140 m²,,,3,2,Entre 20 y 30 años,En buen estado,TC176-610126,,,,,,N/A,,N/A,,1,,N/A,,Comunitaria,,,,,N/A,,,,,N/A,,,,,,,,,,,,,,,
Casa en Nuevo Aranjuez,SENSAHOME,1.303 €/m²,275.000 €,211 m²,https://www.pisos.com/comprar/casa-nuevo_aranjuez_ciudad_de_las_artes_el_mirador-38342847084_518232/,Anuncio actualizado el 11/02/2025,Error al procesar consumo,Error al procesar emisiones,madrid_sur,211 m²,180 m²,428 m²,5,1,Más de 50 años,A reformar,518232-000284,,,Terrazo,,,Frío,Gasoil,N/A,,1,,,Privado,,Noroeste,,,,,,,,,,,,,,,,N/A,,,,,,,,
Dúplex en calle de Fuendetodos,LECASA INMOBILIARIA,2.461 €/m²,320.000 €,130 m²,https://www.pisos.com/comprar/duplex-centro_arroyo_la_fuente28944-51705328428_100500/,Anuncio actualizado el 19/02/2025,Error al procesar consumo,Error al procesar emisiones,madrid_sur,130 m²,,,3,3,Entre 20 y 30 años,En buen estado,SA5580-107361297,1,,,,,N/A,,,,1,,,N/A,N/A,Norte,,,,N/A,4ª,N/A,Entre 60 y 80 €,,N/A,,,,,,,,,,,,,N/A,,
Casa adosada en calle del Sur,HOGARES GRIÑON,1.962 €/m²,314.000 €,160 m²,https://www.pisos.com/comprar/casa_adosada-grinon_centro_urbano-39167690069_101800/,Anuncio actualizado el 19/02/2025,"D, D","D, D",madrid_sur,160 m²,,186 m²,4,2,,,IF76953-SUR,1,,,,,,Central,N/A,,1,N/A,,Privado,,,,,Adosada,,,,,N/A,,,,,,,,,,,,,,,,
Piso en Centro,TECNOCASA - VALDEMORO,2.500 €/m²,180.000 €,72 m²,https://www.pisos.com/comprar/piso-valdemoro_centro28341-51737602486_100200/,Anuncio actualizado el 20/02/2025,"E, E","E, E",madrid_sur,72 m²,,,3,1,Entre 30 y 50 años,Reformado,TC4-609687,,,Gres,,,N/A,N/A,,,,,N/A,,,,,,,N/A,,,,,,,,,,,,,,,,,,,,
Piso en Fuenlabrada,TodoMadridFm,2.898 €/m²,199.990 €,69 m²,https://www.pisos.com/comprar/piso-naranjo_la_serna28941-50863152473_106700/,Anuncio actualizado el 05/02/2025,Error al procesar consumo,Error al procesar emisiones,madrid_sur,69 m²,,,2,1,,,IFC76269-TM827,,,,,,,,,,,,,,,,,,,,,,,,,,,,,,,,,,,,,,,
Piso en calle de los Siete Picos,PROLUCISA S.L,2.783 €/m²,167.000 €,60 m²,https://www.pisos.com/comprar/piso-moraleja_de_enmedio_centro_urbano-47542584180_305300/,Anuncio actualizado el 18/02/2025,Error al procesar consumo,Error al procesar emisiones,madrid_sur,60 m²,60 m²,,2,1,Entre 30 y 50 años,En buen estado,3053-020011,2,N/A,Parquet,De climalit,Aluminio,Frío y calor,Eléctrica,Amueblada,N/A,,N/A,,,,Oeste,,,,,1ª,N/A,Entre 20 y 40 €,Semi amueblado,,,N/A,,,,N/A,,N/A,,,,,,,
Piso en Juan de la Cierva,Huspy,2.241 €/m²,260.000 €,116 m²,https://www.pisos.com/comprar/piso-getafe_juan_de_la_cierva28903-51752341031_108500/,Anuncio actualizado el 17/02/2025,Error al procesar consumo,Error al procesar emisiones,madrid_sur,116 m²,,,4,1,,,AG662-e24b2730-bce8-47ab-a874-6c5329b74692,,,,,,N/A,Gas natural,,,,,,,,Este,,,,,,,,N/A,,,,,,,,,,,,,,,,
Chalet unifamiliar en Urbanización de las Colinas,PROLUCISA S.L,1.058 €/m²,360.000 €,340 m²,https://www.pisos.com/comprar/chalet_unifamiliar-moraleja_de_enmedio_centro_urbano-50012387723_305300/,Anuncio actualizado el 18/02/2025,Error al procesar consumo,Error al procesar emisiones,madrid_sur,340 m²,300 m²,1.800 m²,5,2,Entre 30 y 50 años,A reformar,3053-010014,Más de 2,Roble macizo,Tarima maciza,,Aluminio,,Gasoil,N/A,N/A,Más de 2,,N/A,Privado,Propia,Sureste,N/A,N/A,,,,,,,,,,N/A,N/A,N/A,,Cocina y dormitorio,,N/A,,,,,,
Piso en Getafe,CR HOMES INMOBILIARIA,2.560 €/m²,169.000 €,66 m²,https://www.pisos.com/comprar/piso-getafe_juan_de_la_cierva28903-51677034652_100500/,Anuncio actualizado el 14/02/2025,Error al procesar consumo,Error al procesar emisiones,madrid_sur,66 m²,,,3,1,Más de 50 años,En buen estado,SA84-7056BS,,,Gres,,,,,Cocina amueblada,,,,N/A,,,Suroeste,,,,,2ª,N/A,,,,,,N/A,,,,,N/A,,,,,,,
"Piso en calle de Ordóñez, 23",BAUPRES,2.357 €/m²,165.000 €,70 m²,https://www.pisos.com/comprar/piso-leganes_centro28911-51694483132_510067/,Anuncio actualizado el 03/02/2025,"G, G","G, G",madrid_sur,70 m²,60 m²,,3,1,Más de 50 años,A reformar,4510067-PRO338,,,,,,,,,,,,,,,Noreste,,,,,Bajo,N/A,Entre 40 y 60 €,,,,,,,,,,,,,,,,,
Piso en Centro,"ESTUDIO NUEVO RESTON, S.L.",2.789 €/m²,159.000 €,57 m²,https://www.pisos.com/comprar/piso-valdemoro_centro28341-50910898633_100200/,Anuncio actualizado el 20/02/2025,"E, E","E, E",madrid_sur,57 m²,,,1,1,Entre 30 y 50 años,En buen estado,TC176-606103,,,,,,N/A,N/A,,,,,,,,,,,,N/A,,,,,N/A,,,,,,,,,,,,,,,
Dúplex en calle de los Siete Picos,PROLUCISA S.L,2.549 €/m²,260.000 €,102 m²,https://www.pisos.com/comprar/duplex-moraleja_de_enmedio_centro_urbano-48337832419_305300/,Anuncio actualizado el 18/02/2025,Error al procesar consumo,Error al procesar emisiones,madrid_sur,102 m²,95 m²,,4,2,Entre 10 y 20 años,En buen estado,3053-020021,,,,,,,,,,,,,,,Sureste,,,,,1ª,N/A,,,,,,,,,,,,,,,,,,
Casa en Cubas,ceibo inmobiliaria,Error al procesar precio m²,A consultar,45 m²,https://www.pisos.com/comprar/casa-cubas_de_la_sagra_centro_urbano-7596081483_100500/,Anuncio actualizado el 10/09/2024,Error al procesar consumo,Error al procesar emisiones,madrid_sur,45 m²,35 m²,,1,1,Más de 50 años,,SA1751-PREF-0101/6474,,,Tarima flotante,,,,,,N/A,,,,,,,,,,,,,,,,,,,,,,,,,,,,,,
Casa unifamiliar en calle de la Tahona Antigua,SIGLO XXI -,670 €/m²,210.000 €,313 m²,https://www.pisos.com/comprar/casa_unifamiliar-casco_antiguo_norte-49206038002_992238/,Anuncio actualizado el 18/02/2025,Error al procesar consumo,Error al procesar emisiones,madrid_sur,313 m²,136 m²,313 m²,3,1,Más de 50 años,A reformar,4992238-13466326,,,Terrazo,N/A,Aluminio,Frío,Gasoil,N/A,N/A,1,,,Privado,,,N/A,N/A,Unifamiliar,,,,,,,,,,,N/A,,,,,,,,,,
Piso en calle de San Pascual,INMOBILIARIA CAPITER.,2.027 €/m²,150.000 €,74 m²,https://www.pisos.com/comprar/piso-nuevo_aranjuez_ciudad_de_las_artes_el_mirador-50906087102_515160/,Anuncio actualizado el 20/02/2025,Error al procesar consumo,Error al procesar emisiones,madrid_sur,74 m²,70 m²,,2,1,Entre 30 y 50 años,En buen estado,4515160-002350,2,N/A,Tarima flotante,N/A,PVC,Frío y calor,Eléctrica,N/A,,,,,,,Sur,,,,,Bajo,N/A,Entre 40 y 60 €,,,,N/A,Rejas,,,N/A,,N/A,N/A,N/A,,,,,
