Piso en Parla,ACASA10 SERVICIOS INMOBILIARIOS,1.940 €/m²,130.000 €,67 m²,https://www.pisos.com/comprar/piso-villayuventus_renfe28982-50079205123_100500/,Anuncio actualizado el 04/02/2025,Error al procesar consumo,Error al procesar emisiones,madrid_sur,67 m²,,,2,1,Más de 50 años,En buen estado,SA295-V2636,1,,Mármol,N/A,,,,Cocina amueblada,,,,,,,,,,,,Bajo,,,,,,,N/A,,,,,,,,,,,,
"Piso en Leganés, Zona de - Las Dehesillas Vereda de los Estudiantes",REDPISO LEGANES CENTRO,3.382 €/m²,389.000 €,115 m²,https://www.pisos.com/comprar/piso-las_dehesillas_vereda_de_los_estudiantes28914-49194166020_104700/,Anuncio actualizado el 17/02/2025,Error al procesar consumo,Error al procesar emisiones,madrid_sur,115 m²,,,3,2,Entre 10 y 20 años,En buen estado,STA35-RP1452024131972,N/A,,Tarima maciza,,,Frío y calor,Gas natural,,,2,N/A,N/A,N/A,N/A,Suroeste,,,,N/A,,,,,N/A,,,,,,,,,,,,,,,
Piso en Centro,HOGARES LEGANES,3.169 €/m²,259.900 €,82 m²,https://www.pisos.com/comprar/piso-leganes_centro28911-49209581299_525822/,Anuncio actualizado el 22/11/2024,Error al procesar consumo,Error al procesar emisiones,madrid_sur,82 m²,76 m²,,2,2,Entre 30 y 50 años,En buen estado,4525822-LEGANES CENTRO,2,,,,,,Central,N/A,,,,N/A,,,Sur,,,,N/A,2ª,N/A,,,N/A,,,,,,,,,,,,,,,
Piso en Los Molinos-Los Olivos,TRADER INMOBILIARIO,4.545 €/m²,450.000 €,99 m²,https://www.pisos.com/comprar/piso-los_molinos_los_olivos28906-50921808998_997966/,Anuncio actualizado el 19/02/2025,Error al procesar consumo,Error al procesar emisiones,madrid_sur,99 m²,90 m²,,3,2,Entre 5 y 10 años,A estrenar,4997966-148087,Más de 2,,,,,Frío y calor,,,,1,N/A,,Comunitario,Comunitaria,,,,,N/A,5ª,N/A,,,N/A,N/A,N/A,N/A,,,,,N/A,,,,,N/A,,
Chalet en Loranca- Nuevo Versalles-Parque Miraflores,MISTER PISO,2.261 €/m²,475.000 €,210 m²,https://www.pisos.com/comprar/chalet-loranca_nuevo_versalles_parque_miraflores-50929812402_109300/,Anuncio actualizado el 20/02/2025,Error al procesar consumo,Error al procesar emisiones,madrid_sur,210 m²,200 m²,,5,4,Entre 20 y 30 años,,EP1051-040125,,,,,,N/A,Gas natural,,,N/A,,N/A,N/A,N/A,Sur,,,,,,,N/A,,,,,,,,,,,,,,,,,
Piso en La Rábida-Indiana-La Calera,Gestiones Inmobiliarias Madridsur.,2.346 €/m²,230.000 €,98 m²,https://www.pisos.com/comprar/piso-la_rabida_indiana_la_calera-48350686975_108500/,Anuncio actualizado el 30/12/2024,Error al procesar consumo,Error al procesar emisiones,madrid_sur,98 m²,,,3,2,,,AG637-1722,N/A,,,,,,,,,,,,,,,,,,,,N/A,,,N/A,,,,,,,,,,,,,,,
Piso en Pintores-Ferial,CASALIA.,2.391 €/m²,275.000 €,115 m²,https://www.pisos.com/comprar/piso-pintores_ferial28982-51707192662_524396/,Anuncio actualizado el 18/02/2025,Error al procesar consumo,Error al procesar emisiones,madrid_sur,115 m²,105 m²,,4,2,Entre 20 y 30 años,En buen estado,4524396-027300,Más de 2,,Tarima maciza,,PVC,,Gas natural,,,1,,,,,Sureste,,,,,Bajo,N/A,Entre 40 y 60 €,,N/A,,,,,,,,N/A,,,,,,,
Piso en Parque Inlasa,"CONSULTING INMOBILIARIO PARLA SUR 2004, S.L.U.",1.706 €/m²,128.000 €,75 m²,https://www.pisos.com/comprar/piso-parque_inlasa28981-50891486802_100200/,Anuncio actualizado el 23/01/2025,Error al procesar consumo,Error al procesar emisiones,madrid_sur,75 m²,,,,1,Entre 30 y 50 años,En buen estado,TC134-606733,,,Gres,,,N/A,,N/A,,,,,,,,,,,,,,,,,,,,,,,,,,,,,,,
Casa rústica en Moraleja de Enmedio,Inmobiliaria Burdecor,834 €/m²,480.000 €,575 m²,https://www.pisos.com/comprar/casa_rustica-moraleja_de_enmedio_centro_urbano-48351555716_523618/,Anuncio actualizado el 27/01/2025,Error al procesar consumo,Error al procesar emisiones,madrid_sur,575 m²,570 m²,639 m²,5,2,Más de 50 años,A reformar,4523618-B-196,,,Terrazo,,,,,N/A,N/A,Más de 2,,,Comunitario,,Suroeste,N/A,N/A,Rústica,,,,,,,,,,N/A,N/A,,,,,,,,,,
Chalet adosado en Centro-Arroyo-La Fuente,EUROPISO,2.564 €/m²,595.000 €,232 m²,https://www.pisos.com/comprar/chalet_adosado-centro_arroyo_la_fuente28944-49256723689_993813/,Anuncio actualizado el 19/11/2024,Error al procesar consumo,Error al procesar emisiones,madrid_sur,232 m²,200 m²,,4,3,Entre 20 y 30 años,En buen estado,4993813-F-9607,N/A,Roble,Mármol,,Aluminio,,Gas natural,Amueblada reformada,,Más de 2,N/A,,,,,N/A,N/A,,,,,,,,,,,,N/A,,En salon,,,,,,,,
Dúplex en calle de Zaragoza,HOGALIA Madrid,2.587 €/m²,235.500 €,91 m²,https://www.pisos.com/comprar/duplex-las_dehesillas_vereda_de_los_estudiantes28914-45018504731_100500/,Anuncio actualizado el 29/01/2025,Error al procesar consumo,Error al procesar emisiones,madrid_sur,91 m²,86 m²,,2,2,Entre 20 y 30 años,En buen estado,SA323-FHOG-2588,,,,,,,,,,,,,,,,,,,,3ª,N/A,,,,,,,,,,,,,,,,,,
Piso en El Naranjo,GESTION 3,1.940 €/m²,199.865 €,103 m²,https://www.pisos.com/comprar/piso-naranjo_la_serna-50887133594_500185/,Anuncio actualizado el 11/02/2025,"E, E","E, E",madrid_sur,103 m²,103 m²,,3,1,Entre 30 y 50 años,En buen estado,500185-008462,2,Roble,Parquet,Ventanas de aluminio con cristales climalit,Aluminio,Frío y calor,Gas natural,N/A,N/A,,Con cerradura antiocupas,Abierta y cerrada,Comunitario,,Suroeste,,,,N/A,7ª,N/A,104€,,2 ascensores,Natural,N/A,,N/A,,,,N/A,N/A,,,,,,
Piso en calle Junto calle Turquía El Bercial Getafe,INMOBILIARIAS GARRIDO,3.081 €/m²,339.000 €,110 m²,https://www.pisos.com/comprar/piso-getafe_el_bercial28907-49181228160_520626/,Anuncio actualizado el 03/02/2025,Error al procesar consumo,Error al procesar emisiones,madrid_sur,110 m²,100 m²,,4,2,,Reformado,4520626-Bercial 4 dormitorios,Más de 2,Roble,Tarima maciza,Climalit,PVC,Frío y calor,Central,Grande completa,Salón grande exterior,1,N/A,,Comunitario,Comunitaria,Sur,,,,N/A,4ª,N/A,,,N/A,,N/A,N/A,,,,,,N/A,,,,,,
"Piso en calle de Almansa, 17",SIB INMOBILIARIA,1.970 €/m²,329.000 €,167 m²,https://www.pisos.com/comprar/piso-foso_moreras_agfa-51712451559_523804/,Anuncio actualizado el 07/02/2025,Error al procesar consumo,Error al procesar emisiones,madrid_sur,167 m²,105 m²,,4,2,Entre 30 y 50 años,A reformar,4523804-000072,Más de 2,,Parquet,,Aluminio,,Central,N/A,,1,,,Comunitario,Comunitaria,Oeste,,,,,1ª,,Más de 100 €,,N/A,,N/A,N/A,N/A,,,,N/A,N/A,,,N/A,,,
Chalet en calle Sol,YOUR HOME SERVICIOS INMOBILIARIOS,850 €/m²,514.000 €,604 m²,https://www.pisos.com/comprar/chalet-grinon_centro_urbano-46733458265_100500/,Anuncio actualizado el 12/08/2024,Error al procesar consumo,Error al procesar emisiones,madrid_sur,604 m²,450 m²,605 m²,5,5,Entre 20 y 30 años,En buen estado,SA4750-YH40,1,,Tarima flotante,N/A,,Frío,Gas natural,Cocina amueblada,,,,,Privado,Propia,,,,,,,,,,,,,,,,,,,,,,,,,
Casa pareada en Cubas de La Sagra,INICIATIVAS DABER,1.576 €/m²,487.000 €,309 m²,https://www.pisos.com/comprar/casa_pareada-cubas_de_la_sagra_centro_urbano-51696220804_100500/,Anuncio actualizado el 20/02/2025,Error al procesar consumo,Error al procesar emisiones,madrid_sur,309 m²,,368 m²,4,3,Entre 10 y 20 años,En buen estado,SA5424-0349,1,,Tarima flotante,N/A,,,Gas natural,Cocina amueblada,,1,,N/A,Privado,Propia,,,,Pareada,,,,,,,,,,,,,,,,,,,,,
Piso en San Martín de la Vega,Gestiones Inmobiliarias Madridsur.,2.875 €/m²,230.000 €,80 m²,https://www.pisos.com/comprar/piso-san_martin_de_la_vega_centro_urbano-48395030960_108500/,Anuncio actualizado el 30/12/2024,Error al procesar consumo,Error al procesar emisiones,madrid_sur,80 m²,,,3,2,,,AG637-1753,,,,,,N/A,,,,,,,,,,,,,,,N/A,,,,,,,,,,,,,,,,,,
Finca rústica en La Montaña-Cortijo de San Isidro,ARANDOMUS,Error al procesar precio m²,169.000 €,KI258-ADV0001,https://www.pisos.com/comprar/finca_rustica-la_montana_cortijo_de_san_isidro28300-51705935841_108500/,Anuncio actualizado el 05/02/2025,Error al procesar consumo,Error al procesar emisiones,madrid_sur,,,,,,,,KI258-ADV0001,,,,,,,,,,,,,,,,,,,,,,,,,,,,,,,,,,,,,,,
Apartamento en El Nido-Las Fuentes,INMO III,2.461 €/m²,160.000 €,65 m²,https://www.pisos.com/comprar/apartamento-el_nido_las_fuentes-51674423111_992282/,Anuncio actualizado el 19/02/2025,Error al procesar consumo,Error al procesar emisiones,madrid_sur,65 m²,62 m²,,1,1,,En buen estado,4992282-R- 6482,,,Tarima flotante,,Aluminio,,,N/A,N/A,1,,,,,,,,,,4ª,N/A,,,N/A,,,,,,,,,N/A,N/A,,,,,
Finca rústica en Las Aves-Jardín de Oñate,ARANDOMUS,Error al procesar precio m²,450.000 €,KI258-ADV0004,https://www.pisos.com/comprar/finca_rustica-las_aves_jardin_de_onate28300-51715318577_108500/,Anuncio actualizado el 12/02/2025,Error al procesar consumo,Error al procesar emisiones,madrid_sur,,,,,,,,KI258-ADV0004,,,,,,,,,,,,,,,,,,,,,,,,,,,,,,,,,,,,,,,
Casa adosada en Parla,EMPIRE REAL ESTATE PROPERTIES,2.147 €/m²,377.999 €,176 m²,https://www.pisos.com/comprar/casa_adosada-san_felix_el_legario28981-47545520687_100500/,Anuncio actualizado el 06/02/2025,Error al procesar consumo,Error al procesar emisiones,madrid_sur,176 m²,156 m²,200 m²,6,3,Entre 20 y 30 años,En buen estado,SA3932-SU-2570,1,,Gres,N/A,,Frío,Gas natural,Cocina amueblada,,1,,,Privado,Propia,,,,Adosada,,,,,,,,,,,,,,,,,,,,,
Piso en Centro,INMOREF,2.283 €/m²,379.000 €,166 m²,https://www.pisos.com/comprar/piso-leganes_centro28911-44234993385_526205/,Anuncio actualizado el 19/06/2024,Error al procesar consumo,Error al procesar emisiones,madrid_sur,166 m²,,,4,2,,En buen estado,4526205-000051,,,,,,Frío y calor,Gas natural,N/A,N/A,,,N/A,,,,,,,N/A,Bajo,N/A,,N/A,,N/A,N/A,,N/A,,,,,,,,N/A,,,
"Piso en calle del Matadero, nº -",ALTAMIRA,1.648 €/m²,150.000 €,91 m²,https://www.pisos.com/comprar/piso-valdemoro_centro28343-35058892066_103600/,Anuncio actualizado el 18/02/2025,Error al procesar consumo,Error al procesar emisiones,madrid_sur,91 m²,91 m²,,2,1,,,AM9-2302##33000195,,,,,,,,,,,,,,,,,,,,,,,,,,,,,,,,,,,,,,,
"Piso en Avenida de la Comunidad de Madrid, 4",Soldit Homes,1.910 €/m²,246.500 €,129 m²,https://www.pisos.com/comprar/piso-humanes_de_madrid_centro_urbano-5232369316_109700/,Anuncio actualizado el 20/02/2025,Error al procesar consumo,Error al procesar emisiones,madrid_sur,129 m²,,,3,2,,A estrenar,4525408-0,,,,,,,,,,N/A,,N/A,,,,,,,N/A,5ª,,,,N/A,,,,,,,,,,,,,,,
"Piso en calle de la Virgen del Rocío, nº -",ALTAMIRA,Error al procesar precio m²,A consultar,71 m²,https://www.pisos.com/comprar/piso-calle_pinto_san_roque-46757668756_103600/,Anuncio actualizado el 18/02/2025,Error al procesar consumo,Error al procesar emisiones,madrid_sur,71 m²,71 m²,,3,1,,,AM9-2302##2302_0417_PE0001,,,,,,,,,,,,,,,,,,,,,,,,,,,,,,,,,,,,,,,
Piso en San Martín de la Vega,Gestiones Inmobiliarias Madridsur.,1.578 €/m²,150.000 €,95 m²,https://www.pisos.com/comprar/piso-san_martin_de_la_vega_centro_urbano-48428835690_108500/,Anuncio actualizado el 30/12/2024,Error al procesar consumo,Error al procesar emisiones,madrid_sur,95 m²,,,3,1,,,AG637-1738,N/A,,,,,N/A,,,,,,,,Comunitaria,,,,,,,N/A,,,,,,,,,,,,,,,,,,
Piso en calle de Terreros,ATICONFORT GESTIÓN INMOBILIARIA,3.543 €/m²,209.087 €,59 m²,https://www.pisos.com/comprar/piso-buenos_aires_canada_real_de_toledo_puerta_de_pinto-50041409233_101800/,Anuncio actualizado el 04/12/2024,Error al procesar consumo,Error al procesar emisiones,madrid_sur,59 m²,,,1,1,,,IF6664-5754,1,,,,,,Central,N/A,,1,N/A,N/A,,,,,,,N/A,,,,,N/A,,,,,,,,,,,,,,,
Piso en calle de Rigoberta Menchú,MR. HOUSE REAL ESTATE,2.082 €/m²,239.500 €,115 m²,https://www.pisos.com/comprar/piso-calle_pinto_san_roque-50894534965_100500/,Anuncio actualizado el 29/01/2025,Error al procesar consumo,Error al procesar emisiones,madrid_sur,115 m²,90 m²,,3,2,Entre 20 y 30 años,En buen estado,SA208-8687PV-RS,1,,Gres,N/A,,Frío,Gas natural,Cocina amueblada,,1,N/A,,Comunitario,Propia,Este,,,,,1ª,N/A,Más de 100 €,,N/A,,,,,,,,N/A,N/A,,,,,,
Piso en Avenida de Fuenlabrada,HOGARES LEGANES,3.054 €/m²,274.900 €,90 m²,https://www.pisos.com/comprar/piso-leganes_centro28912-49217714726_525822/,Anuncio actualizado el 02/11/2024,Error al procesar consumo,Error al procesar emisiones,madrid_sur,90 m²,80 m²,,2,2,Entre 10 y 20 años,En buen estado,4525822-LEGANES CENTRO,,,,,,Frío y calor,Eléctrica,,,1,N/A,N/A,,,Oeste,,,,N/A,3ª,N/A,,,N/A,,,,,,,,,,,,,N/A,,
Piso en Juan de La Cierva,SERVICHECK.,2.991 €/m²,176.500 €,59 m²,https://www.pisos.com/comprar/piso-getafe_juan_de_la_cierva28903-51684093977_100500/,Anuncio actualizado el 06/02/2025,Error al procesar consumo,Error al procesar emisiones,madrid_sur,59 m²,,,3,1,Más de 50 años,,SA4312-Venta-Getafe/9940,1,,,,,N/A,,,,,,N/A,,,,,,,,3ª,,,N/A,,,,,,,,,,,,,,N/A,,
Piso en Centro,REMAX ZIELO,2.529 €/m²,247.900 €,98 m²,https://www.pisos.com/comprar/piso-avanzada_la_cueva28944-51758812400_100500/,Anuncio actualizado el 19/02/2025,Error al procesar consumo,Error al procesar emisiones,madrid_sur,98 m²,,,3,2,Entre 10 y 20 años,,SA4230-3610-000757/8893,,,,,,N/A,N/A,,,,,,,Comunitaria,,,,,N/A,Bajo,,,,N/A,,,,,,,,,,,,,,,
Piso en Ciempozuelos,RAYMU,487 €/m²,95.000 €,195 m²,https://www.pisos.com/comprar/piso-cuevas_ilustracion-50898392741_100500/,Anuncio actualizado el 17/02/2025,Error al procesar consumo,Error al procesar emisiones,madrid_sur,195 m²,,,4,3,,,SA4177-SE98V007V-26031/9804,,,,,,,,,,,,,,,,,,,,Bajo,,,,,,,,,,,,,,,,,,,
Chalet adosado en Avenida de la Reina Sofía,HOGARES LEGANES,2.010 €/m²,565.000 €,281 m²,https://www.pisos.com/comprar/chalet_adosado-leganes_norte28919-50037441726_525822/,Anuncio actualizado el 13/12/2024,Error al procesar consumo,Error al procesar emisiones,madrid_sur,281 m²,238 m²,,4,3,Entre 20 y 30 años,En buen estado,4525822-ChaletNorte,Más de 2,,,,,,Gas natural,N/A,N/A,1,,N/A,,Comunitaria,,,,,,,,Entre 80 y 100 €,,,,,,,,,,,,,,,,,
Piso en Humanes de Madrid,"NUEVO HUMANES, S.L.",2.013 €/m²,149.000 €,74 m²,https://www.pisos.com/comprar/piso-humanes_de_madrid_centro_urbano-46755772784_100200/,Anuncio actualizado el 17/02/2025,Error al procesar consumo,Error al procesar emisiones,madrid_sur,74 m²,,,2,1,Menos de 5 años,En buen estado,TC603-591381,,,,,,,,,,,,,,,,,,,,,,,,,,,,,,,,,,,,,,,
Piso en Juan de la Cierva,OPPORTUNITY HOMES,3.316 €/m²,199.000 €,60 m²,https://www.pisos.com/comprar/piso-getafe_juan_de_la_cierva28903-47523555353_515004/,Anuncio actualizado el 21/10/2024,Error al procesar consumo,Error al procesar emisiones,madrid_sur,60 m²,58 m²,,2,1,,Reformado,515004-000844,,,Gres,,"Ventanas osciloparalelas , doble acristalamiento ,",,Electrica punto azul,,,1,,,,,Suroeste,,,,,Bajo,N/A,Incluye el agua,N/A,,,,,,,,,N/A,N/A,,,,,,
Piso en calle de Zaragoza,Aliseda Inmobiliaria,2.587 €/m²,235.500 €,91 m²,https://www.pisos.com/comprar/piso-las_dehesillas_vereda_de_los_estudiantes28914-44212003576_105900/,Anuncio actualizado el 19/12/2024,Error al procesar consumo,Error al procesar emisiones,madrid_sur,91 m²,,,2,2,,,AN1-ANT00030685860,,,,,,,,,,,,,,,,,,,,,,,,N/A,,,,,,,,,,,,,,,
Casa en La Ermita,INMODIVA INMOBILIARIA,2.095 €/m²,440.000 €,210 m²,https://www.pisos.com/comprar/casa-parla_la_ermita28981-43333348928_528127/,Anuncio actualizado el 30/01/2025,Error al procesar consumo,Error al procesar emisiones,madrid_sur,210 m²,189 m²,270 m²,6,3,Entre 10 y 20 años,En buen estado,4528127-000006,Más de 2,,Parquet,,Aluminio,,Gas natural,Amueblada,,2,N/A,,Privado,Propia,,,,,,,,,,,,,Alarma,,,,,,,,,,,,
Ático en Avenida del Sistema Solar,ACC STATE,2.081 €/m²,409.990 €,197 m²,https://www.pisos.com/comprar/atico-parla_este28983-50930935081_526629/,Anuncio actualizado el 23/01/2025,Error al procesar consumo,Error al procesar emisiones,madrid_sur,197 m²,180 m²,,3,2,Entre 10 y 20 años,En buen estado,4526629-258,,,Tarima flotante,,PVC,,Gas natural,,,2,N/A,N/A,,Comunitaria,,,,,N/A,4ª,,,,N/A,,,,,,,,,,N/A,,,,,
Dúplex en Griñón,GARSIERRA,1.749 €/m²,215.200 €,123 m²,https://www.pisos.com/comprar/duplex-grinon_centro_urbano-50025370731_108500/,Anuncio actualizado el 15/12/2024,Error al procesar consumo,Error al procesar emisiones,madrid_sur,123 m²,,,3,2,,,AG588-GRIÑON,N/A,,,N/A,,,N/A,,,,,,,,,,,,,,N/A,,,,,,,,,,,,N/A,,,,,,
Piso en Centro,"INMOHOUSE MADRID 2.005 ,S.L",1.974 €/m²,235.000 €,119 m²,https://www.pisos.com/comprar/piso-aranjuez_centro-51756169914_101800/,Anuncio actualizado el 09/02/2025,Error al procesar consumo,Error al procesar emisiones,madrid_sur,119 m²,,,3,2,,,IF6915-Pavía,1,,,,,,Central,N/A,,1,N/A,,,,,,,,N/A,2ª,,,,,,,,,,,,,,,,,,,
Chalet en calle de las Moreras,CENTURY 21 Homeplace,1.666 €/m²,450.000 €,270 m²,https://www.pisos.com/comprar/chalet-nuevo_aranjuez_ciudad_de_las_artes_el_mirador-42542455844_107700/,Anuncio actualizado el 10/10/2024,Error al procesar consumo,Error al procesar emisiones,madrid_sur,270 m²,250 m²,,5,3,Entre 20 y 30 años,,VE92-121-00306,,,,,,,,,,,,,,,,,,,,,,,,,,,,,,,,,,,,,,,
Casa adosada en calle de Ciempozuelos,INMOCASARRUBUELOS REAL STATE,3.198 €/m²,435.000 €,136 m²,https://www.pisos.com/comprar/casa_adosada-san_isidro_distrito-26755511318_995801/,Anuncio actualizado el 23/09/2022,Error al procesar consumo,Error al procesar emisiones,madrid_sur,136 m²,134 m²,,3,1,Más de 50 años,A reformar,4995801-HI-PERE003699,,Pino,Gres,,Aluminio,,,,,,,,,,,,,Adosada,,,,,,,,,,,,,,,,,,,,,
Casa adosada en calle de Villa Emilia,HOGARES FUENLABRADA,2.218 €/m²,610.000 €,275 m²,https://www.pisos.com/comprar/casa_adosada-cerro_el_molino28942-51754749872_101800/,Anuncio actualizado el 18/02/2025,"E, D","E, D",madrid_sur,275 m²,,,5,4,,,IF77016-ARRO-03,1,,,,,,Central,N/A,,1,N/A,N/A,Privado,Propia,,,,Adosada,N/A,,,,N/A,,,,,,,,,,,,,,,,
Casa en calle del Lince,INNOVA-T INMOBILIARIA TALAVERA,1.929 €/m²,550.000 €,285 m²,https://www.pisos.com/comprar/casa-batres_centro_urbano28976-48355479807_525466/,Anuncio actualizado el 11/10/2024,"E, E","E, E",madrid_sur,285 m²,230 m²,1.300 m²,4,3,Entre 30 y 50 años,En buen estado,4525466-000155,Más de 2,,Gres,,Aluminio,Frío,Gasoil,Amueblada,,2,,N/A,Privado,Propia,,N/A,N/A,,,,,Entre 60 y 80 €,,,,,,,N/A,,N/A,,,,,,,,
Casa adosada en Las Villas,MB Gestión Inmobiliaria -Madrid,2.235 €/m²,675.000 €,302 m²,https://www.pisos.com/comprar/casa_adosada-cerro_el_molino28942-50052703860_100500/,Anuncio actualizado el 27/01/2025,Error al procesar consumo,Error al procesar emisiones,madrid_sur,302 m²,,210 m²,4,3,Entre 20 y 30 años,En buen estado,SA200-R-2003,1,,Gres,N/A,,Frío,Gasoil,Cocina amueblada,,,N/A,N/A,Privado,Propia,,,,Adosada,,,,,,,,,,,,,,,,,,,,,
Piso en San Martín de la Vega,Gestiones Inmobiliarias Madridsur.,1.553 €/m²,160.000 €,103 m²,https://www.pisos.com/comprar/piso-san_martin_de_la_vega_centro_urbano-49266218011_108500/,Anuncio actualizado el 30/12/2024,Error al procesar consumo,Error al procesar emisiones,madrid_sur,103 m²,,,4,1,,,AG637-1771,N/A,,Tarima normal,,,N/A,Gas natural,Individual,,,,No acristalada,,Comunitaria,,,,,,,N/A,,,,,,,,,,,,,,,,,,
Piso en calle de Velázquez,VIVANTIAL,1.364 €/m²,101.000 €,74 m²,https://www.pisos.com/comprar/piso-valdemoro_centro28341-33433108478_109300/,Anuncio actualizado el 28/01/2025,Error al procesar consumo,Error al procesar emisiones,madrid_sur,74 m²,74 m²,,,,,,EP618-6432-2025,,,,,,,,,,,,,,,,,,,,3ª,,,,N/A,,N/A,,,,,,,,,,,,,
Piso en Centro,HOGARES LEGANES,2.967 €/m²,189.900 €,64 m²,https://www.pisos.com/comprar/piso-leganes_centro28912-49234527687_525822/,Anuncio actualizado el 15/11/2024,Error al procesar consumo,Error al procesar emisiones,madrid_sur,64 m²,60 m²,,3,1,,En buen estado,4525822-LEGANES CENTRO,,,,,,,Eléctrica,N/A,N/A,,,,,,Norte,,,,,Bajo,N/A,,,,,,,,,,,,,,,,,,
Piso en calle de Pablo Gargallo,SERGIO ORTIZ MONJE,2.495 €/m²,307.000 €,123 m²,https://www.pisos.com/comprar/piso-la_teneria_i_la_teneria_ii-50931607961_100500/,Anuncio actualizado el 04/02/2025,Error al procesar consumo,Error al procesar emisiones,madrid_sur,123 m²,80 m²,,3,2,Entre 20 y 30 años,En buen estado,SA5597-107181145,1,,,,,N/A,,,,1,,,N/A,,Sur,,,,N/A,2ª,N/A,Entre 80 y 100 €,,N/A,,,,,,,,,N/A,,,,N/A,,
Chalet en Nuevo Aranjuez-Ciudad de las Artes-El Mirador,"INMOHOUSE MADRID 2.005 ,S.L",1.273 €/m²,735.000 €,577 m²,https://www.pisos.com/comprar/chalet-nuevo_aranjuez_ciudad_de_las_artes_el_mirador-45891184117_101800/,Anuncio actualizado el 01/09/2024,Error al procesar consumo,Error al procesar emisiones,madrid_sur,577 m²,,652 m²,5,4,Entre 20 y 30 años,,IF6915-CM,1,,,,,,Central,N/A,,1,N/A,N/A,Privado,Propia,,,,,N/A,,,,,,,,,N/A,,,,,,,,,,,
Ático en San Martín de la Vega,Gestiones Inmobiliarias Madridsur.,1.922 €/m²,248.000 €,129 m²,https://www.pisos.com/comprar/atico-san_martin_de_la_vega_centro_urbano-48415183312_108500/,Anuncio actualizado el 30/12/2024,Error al procesar consumo,Error al procesar emisiones,madrid_sur,129 m²,,,3,2,,,AG637-1725,,,,,,N/A,,,,,,,,,,,,,,,N/A,,,,,,,,,,,,,,,,,,
Chalet en San Martín de la Vega,Gestiones Inmobiliarias Madridsur.,1.879 €/m²,265.000 €,141 m²,https://www.pisos.com/comprar/chalet-san_martin_de_la_vega_centro_urbano-50047590628_108500/,Anuncio actualizado el 30/12/2024,Error al procesar consumo,Error al procesar emisiones,madrid_sur,141 m²,,,3,3,,,AG637-1787,N/A,,Gres,,,N/A,Gas natural,Individual,,,,,,,,,,,,,,,,,,,,,,,,,,,,,,,
Apartamento en Parla Este,REDPISO PARLA,3.700 €/m²,370.000 €,100 m²,https://www.pisos.com/comprar/apartamento-parla_este28983-50899613670_997672/,Anuncio actualizado el 27/01/2025,Error al procesar consumo,Error al procesar emisiones,madrid_sur,100 m²,80 m²,,3,2,Entre 10 y 20 años,En buen estado,4997672-13448623,Más de 2,,Tarima flotante,,,Frío y calor,Gas natural,Amueblada,,1,,,Privado,Propia,Norte,,,,N/A,Bajo,N/A,,,N/A,N/A,N/A,N/A,Cuarto a parte,,N/A,,N/A,N/A,,,,,,
Piso en Cristina-Los Cisnes,Hounting,2.108 €/m²,310.000 €,147 m²,https://www.pisos.com/comprar/piso-cristina_los_cisnes-50004507708_100500/,Anuncio actualizado el 20/02/2025,Error al procesar consumo,Error al procesar emisiones,madrid_sur,147 m²,,,4,2,,En buen estado,SA5364-2110/21100032/197,,,,,,,,N/A,,1,,N/A,N/A,N/A,,,,,N/A,1ª,N/A,,,N/A,,,,,,,,,,,N/A,,,,
"Piso en Avenida de la Comunidad de Madrid, 4",Soldit Homes,1.835 €/m²,251.500 €,137 m²,https://www.pisos.com/comprar/piso-humanes_de_madrid_centro_urbano-5200280755_109700/,Anuncio actualizado el 20/02/2025,Error al procesar consumo,Error al procesar emisiones,madrid_sur,137 m²,,,3,2,,A estrenar,4525408-21765176,,,,,,,,,,N/A,,N/A,,,,,,,N/A,4ª,,,,N/A,,,,,,,,,,,,,,,
Piso en Nuevo Aranjuez-Ciudad de las Artes-El Mirador,ARANDOMUS,2.373 €/m²,235.000 €,99 m²,https://www.pisos.com/comprar/piso-nuevo_aranjuez_ciudad_de_las_artes_el_mirador-51740285155_108500/,Anuncio actualizado el 05/02/2025,Error al procesar consumo,Error al procesar emisiones,madrid_sur,99 m²,,,3,1,,,KI258-ADV0014,,,,,,N/A,Eléctrica,,,,N/A,,,,Noroeste,,,,,,N/A,,N/A,,,,,,,,,,,,,,,,
Casa en San Martín de la Vega,Gestiones Inmobiliarias Madridsur.,2.280 €/m²,187.000 €,82 m²,https://www.pisos.com/comprar/casa-san_martin_de_la_vega_centro_urbano-50859247159_108500/,Anuncio actualizado el 19/01/2025,Error al procesar consumo,Error al procesar emisiones,madrid_sur,82 m²,,,3,1,,,AG637-1791,,,Gres,N/A,,N/A,Gas natural,Individual,,,,,,,Este,,,,,,,,,,,,,,,,,,,,,,,,
Dúplex en calle de Terreros,ATICONFORT GESTIÓN INMOBILIARIA,2.810 €/m²,362.500 €,129 m²,https://www.pisos.com/comprar/duplex-buenos_aires_canada_real_de_toledo_puerta_de_pinto-50080692716_101800/,Anuncio actualizado el 04/12/2024,Error al procesar consumo,Error al procesar emisiones,madrid_sur,129 m²,,,3,2,Menos de 5 años,,IF6664-5760,1,,,,,,Central,N/A,,1,N/A,,,,,,,,N/A,1ª,,,,N/A,,,,,,,,,,,,,,,
"Piso en calle de San Alfonso, 18",ALTAMIRA,2.263 €/m²,129.000 €,57 m²,https://www.pisos.com/comprar/piso-leganes_la_fortuna28917-38426795619_103600/,Anuncio actualizado el 18/02/2025,Error al procesar consumo,Error al procesar emisiones,madrid_sur,57 m²,48 m²,,1,1,,,AM9-2054##01401011,,,,,,,,,,,,,,,,,,,N/A,,,,,N/A,,,,,,,,,,,,,,,
Piso en calle Clcapitan Muro Duran 9,HIPOGES IBERIA,2.483 €/m²,226.000 €,91 m²,https://www.pisos.com/comprar/piso-leganes_norte28919-50022344374_100700/,Anuncio actualizado el 01/02/2025,Error al procesar consumo,Error al procesar emisiones,madrid_sur,91 m²,91 m²,,,,,,GTRE-01344,,,,,,,,,,,,,,,,,,,,,,,,,,,,,,,,,,,,,,,
Piso en calle del Río Manzanares,HIPOGES IBERIA,1.269 €/m²,113.000 €,89 m²,https://www.pisos.com/comprar/piso-brezo_guardia_civil28342-50097934316_100700/,Anuncio actualizado el 13/12/2024,Error al procesar consumo,Error al procesar emisiones,madrid_sur,89 m²,89 m²,,,,,,FRRE-00317,,,,,,,,,,,,,,,,,,,,,,,,,,,,,,,,,,,,,,,
Piso en Avenida Hispanidad,Aliseda Inmobiliaria,1.290 €/m²,111.000 €,86 m²,https://www.pisos.com/comprar/piso-avanzada_la_cueva28945-37552957274_107000/,Anuncio actualizado el 23/01/2025,Error al procesar consumo,Error al procesar emisiones,madrid_sur,86 m²,,,,,,,AS1-52715967,,,,,,,,,,,,,,,,,,,,,,,,,,,,,,,,,,,,,,,
Chalet pareado en calle Bolonia,Inmobiliar,1.635 €/m²,359.900 €,220 m²,https://www.pisos.com/comprar/chalet_pareado-pintores_ferial28982-49196828983_524253/,Anuncio actualizado el 08/11/2024,Error al procesar consumo,Error al procesar emisiones,madrid_sur,220 m²,204 m²,,5,3,Entre 30 y 50 años,En buen estado,4524253-000006,,,Gres,,,,Gas natural,,,1,,N/A,,,,,,,,,,,,,,,,,,,,,,,,,,,
"Piso en calle del Paular, nº -",ALTAMIRA,1.333 €/m²,97.339 €,73 m²,https://www.pisos.com/comprar/piso-centro_arroyo_la_fuente28944-51666845679_103600/,Anuncio actualizado el 18/02/2025,Error al procesar consumo,Error al procesar emisiones,madrid_sur,73 m²,70 m²,,3,1,,,AM9-2302##9186_0038_PE0001,,,,,,,,,,,,,,,,,,,,,,,,,,,,,,,,,,,,,,,
Casa en calle del Pintor Ruiz,BOENDE Servicios Inmobiliarios,1.762 €/m²,274.900 €,156 m²,https://www.pisos.com/comprar/casa-titulcia_centro_urbano-50045083065_522761/,Anuncio actualizado el 16/12/2024,"F, F","F, F",madrid_sur,156 m²,140 m²,466 m²,3,1,Entre 30 y 50 años,En buen estado,522761-94_22,Más de 2,N/A,Gres,,PVC,Frío y calor,Gasoil,N/A,N/A,1,,N/A,,,Este,N/A,N/A,,,,,,N/A,,,,,,N/A,,,,,,,,,,
